{
  "policyVersion": "1",
  "id": "x24-neutral-b",
  "classification": {
    "annotationRoles": [
      {
        "role": "application",
        "prefix": "[Note]",
        "trim": "ecma262-2024-start",
        "labelCase": "upper"
      },
      {
        "role": "document",
        "prefix": "[Leaf]",
        "trim": "none",
        "labelCase": "upper"
      }
    ],
    "insertSeparator": ": "
  },
  "attachment": {
    "applicationHost": {
      "type": "bpmn:Task",
      "mode": "exact"
    },
    "nonActivityHost": "preserve-report"
  },
  "metrics": {
    "id": "x24-metrics-b",
    "unit": "per-mille-em",
    "firstCodePoint": 32,
    "regular": [
      560,
      563,
      566,
      569,
      572,
      575,
      578,
      581,
      584,
      587,
      590,
      593,
      596,
      599,
      602,
      605,
      608,
      611,
      614,
      617,
      620,
      623,
      626,
      629,
      632,
      635,
      638,
      641,
      644,
      647,
      650,
      653,
      656,
      659,
      662,
      665,
      668,
      671,
      674,
      677,
      680,
      683,
      686,
      689,
      692,
      695,
      698,
      701,
      704,
      707,
      710,
      713,
      716,
      719,
      722,
      725,
      728,
      731,
      734,
      737,
      740,
      743,
      746,
      749,
      752,
      755,
      758,
      761,
      764,
      767,
      770,
      773,
      776,
      779,
      782,
      785,
      788,
      791,
      794,
      797,
      800,
      803,
      806,
      809,
      812,
      815,
      818,
      821,
      824,
      827,
      830,
      833,
      836,
      839,
      842
    ],
    "bold": [
      640,
      643,
      646,
      649,
      652,
      655,
      658,
      661,
      664,
      667,
      670,
      673,
      676,
      679,
      682,
      685,
      688,
      691,
      694,
      697,
      700,
      703,
      706,
      709,
      712,
      715,
      718,
      721,
      724,
      727,
      730,
      733,
      736,
      739,
      742,
      745,
      748,
      751,
      754,
      757,
      760,
      763,
      766,
      769,
      772,
      775,
      778,
      781,
      784,
      787,
      790,
      793,
      796,
      799,
      802,
      805,
      808,
      811,
      814,
      817,
      820,
      823,
      826,
      829,
      832,
      835,
      838,
      841,
      844,
      847,
      850,
      853,
      856,
      859,
      862,
      865,
      868,
      871,
      874,
      877,
      880,
      883,
      886,
      889,
      892,
      895,
      898,
      901,
      904,
      907,
      910,
      913,
      916,
      919,
      922
    ],
    "fallback": 640,
    "lineHeight": 1.5,
    "aliases": [
      {
        "from": "É",
        "to": "E"
      }
    ],
    "license": "CC0-1.0",
    "attribution": "Synthetic uniform advance table with one width alias, authored for the x24 seal."
  },
  "navigation": {
    "mode": "legacy-rules",
    "rules": [
      "name-equal",
      "section-equal"
    ]
  },
  "presentation": {
    "looks": [
      {
        "alias": "beta-look",
        "renderer": "recolor",
        "flat": false,
        "palette": "upstream",
        "paletteFloor": 60,
        "markerSelectors": [
          ".x24-beta-marker",
          "[data-marker='x24-beta']"
        ],
        "tokens": {
          "fontFamily": "serif",
          "fontSize": 13,
          "strokeWidth": 2,
          "stroke": "#606060",
          "fill": "#636363",
          "text": "#666666",
          "labelText": "#696969",
          "headerText": "#6c6c6c",
          "flow": "#6f6f6f",
          "link": "#727272",
          "docLink": "#757575",
          "docLinkDash": "6 3",
          "dataLinkArrow": false,
          "taskLine": "#787878",
          "taskFill": "#7b7b7b",
          "taskFillEnd": "#7e7e7e",
          "eventLine": "#818181",
          "eventFill": "#848484",
          "gatewayLine": "#878787",
          "gatewayFill": "#8a8a8a",
          "poolLine": "#8d8d8d",
          "poolFill": "#909090",
          "laneLine": "#939393",
          "laneFill": "#969696",
          "laneHeaderFill": "#999999",
          "externalLine": "#9c9c9c",
          "externalFill": "#9f9f9f",
          "docLine": "#a2a2a2",
          "docFill": "#a5a5a5",
          "dataLine": "#a8a8a8",
          "dataFill": "#ababab",
          "appLine": "#aeaeae",
          "appFill": "#b1b1b1"
        }
      },
      {
        "alias": "gamma-look",
        "renderer": "annotated",
        "flat": false,
        "palette": "annotated",
        "paletteFloor": 96,
        "markerSelectors": [
          ".x24-gamma-marker"
        ],
        "tokens": {
          "fontFamily": "fantasy",
          "fontSize": 12,
          "strokeWidth": 1,
          "stroke": "#424242",
          "fill": "#454545",
          "text": "#484848",
          "labelText": "#4b4b4b",
          "headerText": "#4e4e4e",
          "flow": "#515151",
          "link": "#545454",
          "docLink": "#575757",
          "docLinkDash": "2 2",
          "dataLinkArrow": false,
          "taskLine": "#5a5a5a",
          "taskFill": "#5d5d5d",
          "taskFillEnd": "#606060",
          "eventLine": "#636363",
          "eventFill": "#666666",
          "gatewayLine": "#696969",
          "gatewayFill": "#6c6c6c",
          "poolLine": "#6f6f6f",
          "poolFill": "#727272",
          "laneLine": "#757575",
          "laneFill": "#787878",
          "laneHeaderFill": "#7b7b7b",
          "externalLine": "#7e7e7e",
          "externalFill": "#818181",
          "docLine": "#848484",
          "docFill": "#878787",
          "dataLine": "#8a8a8a",
          "dataFill": "#8d8d8d",
          "appLine": "#909090",
          "appFill": "#939393"
        }
      }
    ],
    "legacyOptions": {
      "flatDrawing": "flat-b"
    },
    "layout": {
      "poolHeader": 28,
      "laneHeader": 26,
      "minLaneHeight": 180,
      "channel": 22,
      "fontSize": 11,
      "labelFontSize": 10,
      "nodeSizes": [
        {
          "kind": "task",
          "width": 110,
          "height": 76
        },
        {
          "kind": "subprocess",
          "width": 112,
          "height": 74
        },
        {
          "kind": "call",
          "width": 102,
          "height": 58
        },
        {
          "kind": "gateway",
          "width": 40,
          "height": 40
        },
        {
          "kind": "start",
          "width": 38,
          "height": 38
        },
        {
          "kind": "end",
          "width": 38,
          "height": 38
        },
        {
          "kind": "event",
          "width": 38,
          "height": 38
        },
        {
          "kind": "object-in",
          "width": 34,
          "height": 44
        },
        {
          "kind": "object-out",
          "width": 34,
          "height": 44
        },
        {
          "kind": "port-in",
          "width": 36,
          "height": 46
        },
        {
          "kind": "port-out",
          "width": 36,
          "height": 46
        },
        {
          "kind": "document",
          "width": 96,
          "height": 44
        }
      ],
      "labelMaxWidth": {
        "event": 110,
        "item": 90
      },
      "appBadge": {
        "minWidth": 74,
        "height": 26,
        "overlap": 7,
        "chrome": 24,
        "margin": 8,
        "gap": 6,
        "font": 11,
        "linkInset": 14
      },
      "document": {
        "width": 106,
        "minHeight": 60,
        "band": 12,
        "textTop": 18,
        "waveTop": 0.7,
        "padX": 7,
        "padBottom": 5
      },
      "laneHeaderWidth": 36,
      "poolStrip": 27
    },
    "exportStyles": {
      "drawio": {
        "pool": "x24b=pool;",
        "lane": "x24b=lane;",
        "start": "x24b=start;",
        "end": "x24b=end;",
        "task": "x24b=task;",
        "subprocess": "x24b=subprocess;",
        "gatewayBase": "x24b=gateway;gw=",
        "external": "x24b=call;",
        "application": "x24b=badge;",
        "document": "x24b=sheet;",
        "item": "x24b=item;",
        "edgeHead": "x24b=edge;",
        "flowTail": "x24b=flow;",
        "linkTail": "x24b=link;",
        "event": "x24b=event;",
        "poolHeaderWidth": 36,
        "dx": 44,
        "dy": 6,
        "appBand": 7
      },
      "decode": {
        "associationIdSuffix": "-note-link",
        "kinds": [
          {
            "match": [
              {
                "key": "shape",
                "value": "x24.leaf"
              }
            ],
            "kind": "textAnnotation"
          },
          {
            "match": [
              {
                "key": "shape",
                "value": "x24.note"
              }
            ],
            "kind": "textAnnotation"
          }
        ],
        "roles": [
          {
            "match": [
              {
                "key": "shape",
                "value": "x24.leaf"
              }
            ],
            "role": "document"
          },
          {
            "match": [
              {
                "key": "shape",
                "value": "x24.note"
              }
            ],
            "role": "application"
          }
        ]
      }
    },
    "palette": {
      "entries": [
        {
          "id": "beta.note",
          "title": "Note",
          "bpmnType": "bpmn:TextAnnotation",
          "group": "annotations",
          "icon": "bpmn-icon-text-annotation",
          "initialRole": "application"
        },
        {
          "id": "beta.leaf",
          "title": "Leaf",
          "bpmnType": "bpmn:TextAnnotation",
          "group": "annotations",
          "icon": "bpmn-icon-text-annotation",
          "initialRole": "document"
        },
        {
          "id": "beta.gateway",
          "title": "Gateway",